{
  "name": "seed_robust",
  "backend": "mock",
  "brand_prompt": "brand_robust_v1",
  "crp_prompt": "crp_robust_v1",
  "use_logo_ocr": true,
  "use_logo_caption": true,
  "prompt_defense": true,
  "popularity_validation": "google-indexed",
  "hosting_rule": "strict",
  "max_interactions": 1,
  "brand_confidence_min": 0.80,
  "report_policy": "mismatch_and_crp",
  "temperature": 0.0,
  "runtime_budget_sec": 6.0,
  "hypothesis": "Robust prompts emphasise prompt-injection resistance and brand-cue grounding; should not lose recall on legitimate phishing while resisting injection attacks."
}
