{
  "name": "seed_visual_only",
  "backend": "mock",
  "brand_prompt": "brand_default_v1",
  "crp_prompt": "crp_default_v1",
  "use_logo_ocr": true,
  "use_logo_caption": true,
  "prompt_defense": false,
  "popularity_validation": "google-indexed",
  "hosting_rule": "strict",
  "max_interactions": 0,
  "brand_confidence_min": 0.80,
  "report_policy": "mismatch_and_crp",
  "temperature": 0.0,
  "runtime_budget_sec": 5.0,
  "hypothesis": "Ablation: drop prompt-defense and CRP transitions to quantify their contribution. Expected to under-perform on prompt-injection and hidden-login cases."
}
