{
  "name": "seed_low_cost",
  "backend": "mock",
  "brand_prompt": "brand_default_v1",
  "crp_prompt": "crp_default_v1",
  "use_logo_ocr": true,
  "use_logo_caption": false,
  "prompt_defense": true,
  "popularity_validation": "cached",
  "hosting_rule": "relaxed",
  "max_interactions": 0,
  "brand_confidence_min": 0.80,
  "report_policy": "mismatch_and_crp",
  "temperature": 0.0,
  "runtime_budget_sec": 3.0,
  "hypothesis": "Caption modality and live popularity validation are the most expensive components; turning them off should slash cost with only modest recall loss."
}
